{
  "$schema": "./metadata-schema.json",
  "baseline_id": "shell-empty-light",
  "theme": "light",
  "workbench": "PartDesignWorkbench",
  "fixture_document": "empty-document",
  "visible_toolbars": [
    "Edit",
    "File",
    "Help",
    "Part Design Dress-Up Features",
    "Part Design Helper Features",
    "Part Design Modeling Features",
    "Part Design Transformation Features",
    "Structure",
    "View",
    "Workbench"
  ],
  "visible_panels": [
    "Model",
    "Tasks"
  ],
  "active_task": null,
  "artifacts": {
    "full_window": "docs/parity/baselines/screenshots/shell-empty-light.png",
    "viewport_crop": null,
    "tree_property_crop": "docs/parity/baselines/screenshots/shell-empty-light-tree-property.png",
    "recording": null
  },
  "notes": "Captured from Qt shell baseline helper."
}
